{
  "$schema": "https://github.com/smashkat12/kiro-flow/schemas/kiro-agent.schema.json",
  "name": "kf-repo-architect",
  "description": "Repository structure optimization and multi-repo management with ruv-swarm coordination for scalable project architecture and development workflows",
  "prompt": "file://./prompts/kf-repo-architect.md",
  "tools": [
    "read",
    "shell",
    "write",
    "subagent",
    "@claude-flow/agent_spawn",
    "@claude-flow/github_issue_track",
    "@claude-flow/github_metrics",
    "@claude-flow/github_pr_manage",
    "@claude-flow/github_repo_analyze",
    "@claude-flow/github_workflow",
    "@claude-flow/memory_bridge_status",
    "@claude-flow/memory_cleanup",
    "@claude-flow/memory_compress",
    "@claude-flow/memory_delete",
    "@claude-flow/memory_detailed-stats",
    "@claude-flow/memory_export",
    "@claude-flow/memory_import",
    "@claude-flow/memory_import_claude",
    "@claude-flow/memory_list",
    "@claude-flow/memory_migrate",
    "@claude-flow/memory_retrieve",
    "@claude-flow/memory_search",
    "@claude-flow/memory_search_unified",
    "@claude-flow/memory_stats",
    "@claude-flow/memory_store",
    "@claude-flow/swarm_init",
    "@claude-flow/task_assign",
    "@claude-flow/task_cancel",
    "@claude-flow/task_complete",
    "@claude-flow/task_create",
    "@claude-flow/task_list",
    "@claude-flow/task_retry",
    "@claude-flow/task_status",
    "@claude-flow/task_summary",
    "@claude-flow/task_update",
    "@claude-flow/workflow_cancel",
    "@claude-flow/workflow_create",
    "@claude-flow/workflow_delete",
    "@claude-flow/workflow_execute",
    "@claude-flow/workflow_list",
    "@claude-flow/workflow_pause",
    "@claude-flow/workflow_resume",
    "@claude-flow/workflow_run",
    "@claude-flow/workflow_status",
    "@claude-flow/workflow_stop",
    "@claude-flow/workflow_template",
    "@claude-flow/workflow_validate",
    "@github/create_or_update_file",
    "@github/create_repository",
    "@github/fork_repository",
    "@github/push_files",
    "@github/search_repositories"
  ],
  "allowedTools": [
    "read",
    "@claude-flow/agent_spawn",
    "@claude-flow/github_issue_track",
    "@claude-flow/github_metrics",
    "@claude-flow/github_pr_manage",
    "@claude-flow/github_repo_analyze",
    "@claude-flow/github_workflow",
    "@claude-flow/memory_bridge_status",
    "@claude-flow/memory_cleanup",
    "@claude-flow/memory_compress",
    "@claude-flow/memory_delete",
    "@claude-flow/memory_detailed-stats",
    "@claude-flow/memory_export",
    "@claude-flow/memory_import",
    "@claude-flow/memory_import_claude",
    "@claude-flow/memory_list",
    "@claude-flow/memory_migrate",
    "@claude-flow/memory_retrieve",
    "@claude-flow/memory_search",
    "@claude-flow/memory_search_unified",
    "@claude-flow/memory_stats",
    "@claude-flow/memory_store",
    "@claude-flow/swarm_init",
    "@claude-flow/task_assign",
    "@claude-flow/task_cancel",
    "@claude-flow/task_complete",
    "@claude-flow/task_create",
    "@claude-flow/task_list",
    "@claude-flow/task_retry",
    "@claude-flow/task_status",
    "@claude-flow/task_summary",
    "@claude-flow/task_update",
    "@claude-flow/workflow_cancel",
    "@claude-flow/workflow_create",
    "@claude-flow/workflow_delete",
    "@claude-flow/workflow_execute",
    "@claude-flow/workflow_list",
    "@claude-flow/workflow_pause",
    "@claude-flow/workflow_resume",
    "@claude-flow/workflow_run",
    "@claude-flow/workflow_status",
    "@claude-flow/workflow_stop",
    "@claude-flow/workflow_template",
    "@claude-flow/workflow_validate"
  ],
  "hooks": {
    "agentSpawn": [
      {
        "command": "node .kiro/kiro-flow/kiro-hook-adapter.cjs session-bridge memory-inject session-restore auto-memory:import"
      }
    ],
    "userPromptSubmit": [
      {
        "command": "node .kiro/kiro-flow/kiro-hook-adapter.cjs route"
      }
    ],
    "preToolUse": [
      {
        "matcher": "execute_bash",
        "command": "node .kiro/kiro-flow/kiro-hook-adapter.cjs pre-bash"
      },
      {
        "matcher": "fs_write",
        "command": "node .kiro/kiro-flow/kiro-hook-adapter.cjs pre-edit"
      }
    ],
    "postToolUse": [
      {
        "matcher": "fs_write",
        "command": "node .kiro/kiro-flow/kiro-hook-adapter.cjs post-edit"
      },
      {
        "matcher": "execute_bash",
        "command": "node .kiro/kiro-flow/kiro-hook-adapter.cjs post-bash"
      }
    ],
    "stop": [
      {
        "command": "node .kiro/kiro-flow/kiro-hook-adapter.cjs session-end auto-memory:sync session-bridge memory-refresh"
      }
    ]
  },
  "includeMcpJson": true
}
