{
  "$schema": "https://github.com/smashkat12/kiro-flow/schemas/kiro-agent.schema.json",
  "name": "kf-queen-coordinator",
  "description": "The sovereign orchestrator of hierarchical hive operations, managing strategic decisions, resource allocation, and maintaining hive coherence through centralized-decentralized hybrid control",
  "prompt": "file://./prompts/kf-queen-coordinator.md",
  "tools": [
    "read",
    "shell",
    "write",
    "@claude-flow/agent_execute",
    "@claude-flow/agent_health",
    "@claude-flow/agent_list",
    "@claude-flow/agent_logs",
    "@claude-flow/agent_pool",
    "@claude-flow/agent_spawn",
    "@claude-flow/agent_status",
    "@claude-flow/agent_terminate",
    "@claude-flow/agent_update",
    "@claude-flow/config_export",
    "@claude-flow/config_get",
    "@claude-flow/config_import",
    "@claude-flow/config_list",
    "@claude-flow/config_reset",
    "@claude-flow/config_set",
    "@claude-flow/coordination_consensus",
    "@claude-flow/coordination_load_balance",
    "@claude-flow/coordination_metrics",
    "@claude-flow/coordination_node",
    "@claude-flow/coordination_orchestrate",
    "@claude-flow/coordination_sync",
    "@claude-flow/coordination_topology",
    "@claude-flow/hive-mind_broadcast",
    "@claude-flow/hive-mind_consensus",
    "@claude-flow/hive-mind_init",
    "@claude-flow/hive-mind_join",
    "@claude-flow/hive-mind_leave",
    "@claude-flow/hive-mind_memory",
    "@claude-flow/hive-mind_optimize-memory",
    "@claude-flow/hive-mind_shutdown",
    "@claude-flow/hive-mind_spawn",
    "@claude-flow/hive-mind_status",
    "@claude-flow/memory_bridge_status",
    "@claude-flow/memory_cleanup",
    "@claude-flow/memory_compress",
    "@claude-flow/memory_delete",
    "@claude-flow/memory_detailed-stats",
    "@claude-flow/memory_export",
    "@claude-flow/memory_import",
    "@claude-flow/memory_import_claude",
    "@claude-flow/memory_list",
    "@claude-flow/memory_migrate",
    "@claude-flow/memory_retrieve",
    "@claude-flow/memory_search",
    "@claude-flow/memory_search_unified",
    "@claude-flow/memory_stats",
    "@claude-flow/memory_store",
    "@claude-flow/progress_check",
    "@claude-flow/progress_summary",
    "@claude-flow/progress_sync",
    "@claude-flow/progress_watch",
    "@claude-flow/session_current",
    "@claude-flow/session_delete",
    "@claude-flow/session_export",
    "@claude-flow/session_import",
    "@claude-flow/session_info",
    "@claude-flow/session_list",
    "@claude-flow/session_restore",
    "@claude-flow/session_save",
    "@claude-flow/swarm_health",
    "@claude-flow/swarm_init",
    "@claude-flow/swarm_shutdown",
    "@claude-flow/swarm_status",
    "@claude-flow/task_assign",
    "@claude-flow/task_cancel",
    "@claude-flow/task_complete",
    "@claude-flow/task_create",
    "@claude-flow/task_list",
    "@claude-flow/task_retry",
    "@claude-flow/task_status",
    "@claude-flow/task_summary",
    "@claude-flow/task_update"
  ],
  "allowedTools": [
    "read",
    "@claude-flow/agent_execute",
    "@claude-flow/agent_health",
    "@claude-flow/agent_list",
    "@claude-flow/agent_logs",
    "@claude-flow/agent_pool",
    "@claude-flow/agent_spawn",
    "@claude-flow/agent_status",
    "@claude-flow/agent_terminate",
    "@claude-flow/agent_update",
    "@claude-flow/config_export",
    "@claude-flow/config_get",
    "@claude-flow/config_import",
    "@claude-flow/config_list",
    "@claude-flow/config_reset",
    "@claude-flow/config_set",
    "@claude-flow/coordination_consensus",
    "@claude-flow/coordination_load_balance",
    "@claude-flow/coordination_metrics",
    "@claude-flow/coordination_node",
    "@claude-flow/coordination_orchestrate",
    "@claude-flow/coordination_sync",
    "@claude-flow/coordination_topology",
    "@claude-flow/hive-mind_broadcast",
    "@claude-flow/hive-mind_consensus",
    "@claude-flow/hive-mind_init",
    "@claude-flow/hive-mind_join",
    "@claude-flow/hive-mind_leave",
    "@claude-flow/hive-mind_memory",
    "@claude-flow/hive-mind_optimize-memory",
    "@claude-flow/hive-mind_shutdown",
    "@claude-flow/hive-mind_spawn",
    "@claude-flow/hive-mind_status",
    "@claude-flow/memory_bridge_status",
    "@claude-flow/memory_cleanup",
    "@claude-flow/memory_compress",
    "@claude-flow/memory_delete",
    "@claude-flow/memory_detailed-stats",
    "@claude-flow/memory_export",
    "@claude-flow/memory_import",
    "@claude-flow/memory_import_claude",
    "@claude-flow/memory_list",
    "@claude-flow/memory_migrate",
    "@claude-flow/memory_retrieve",
    "@claude-flow/memory_search",
    "@claude-flow/memory_search_unified",
    "@claude-flow/memory_stats",
    "@claude-flow/memory_store",
    "@claude-flow/progress_check",
    "@claude-flow/progress_summary",
    "@claude-flow/progress_sync",
    "@claude-flow/progress_watch",
    "@claude-flow/session_current",
    "@claude-flow/session_delete",
    "@claude-flow/session_export",
    "@claude-flow/session_import",
    "@claude-flow/session_info",
    "@claude-flow/session_list",
    "@claude-flow/session_restore",
    "@claude-flow/session_save",
    "@claude-flow/swarm_health",
    "@claude-flow/swarm_init",
    "@claude-flow/swarm_shutdown",
    "@claude-flow/swarm_status",
    "@claude-flow/task_assign",
    "@claude-flow/task_cancel",
    "@claude-flow/task_complete",
    "@claude-flow/task_create",
    "@claude-flow/task_list",
    "@claude-flow/task_retry",
    "@claude-flow/task_status",
    "@claude-flow/task_summary",
    "@claude-flow/task_update"
  ],
  "hooks": {
    "agentSpawn": [
      {
        "command": "node .kiro/kiro-flow/kiro-hook-adapter.cjs session-restore auto-memory:import"
      }
    ],
    "userPromptSubmit": [
      {
        "command": "node .kiro/kiro-flow/kiro-hook-adapter.cjs route"
      }
    ],
    "preToolUse": [
      {
        "matcher": "execute_bash",
        "command": "node .kiro/kiro-flow/kiro-hook-adapter.cjs pre-bash"
      },
      {
        "matcher": "fs_write",
        "command": "node .kiro/kiro-flow/kiro-hook-adapter.cjs pre-edit"
      }
    ],
    "postToolUse": [
      {
        "matcher": "fs_write",
        "command": "node .kiro/kiro-flow/kiro-hook-adapter.cjs post-edit"
      },
      {
        "matcher": "execute_bash",
        "command": "node .kiro/kiro-flow/kiro-hook-adapter.cjs post-bash"
      }
    ],
    "stop": [
      {
        "command": "node .kiro/kiro-flow/kiro-hook-adapter.cjs session-end auto-memory:sync"
      }
    ]
  },
  "includeMcpJson": true
}
